{
  "schemaVersion": 1,
  "caseId": "cr-dpapi-secret-loss",
  "agent": "code-review",
  "description": "Real bug (fixed in c76256de): on Windows config persist, the GitHub PAT plaintext is erased BEFORE confirming its DPAPI encryption succeeded, unlike the McpAuthToken field two lines below which guards the erase on encryption success. If ProtectSecretForConfig returns empty, the only copy of the PAT is lost.",
  "repoRef": "5c6e97fd",
  "baseBranch": "develop",
  "files": [
    "Source_Core/src/ConfigManager.cpp"
  ],
  "diff": "--- a/Source_Core/src/ConfigManager.cpp\n+++ b/Source_Core/src/ConfigManager.cpp\n@@ persist secrets (Windows DPAPI) @@\n #if defined(_WIN32)\n     j.erase(\"token\");\n     j.erase(\"plane_api_key\");\n     j.erase(\"github_pat\");\n     j[\"token_enc\"] = ProtectSecretForConfig(config.ApiToken);\n     j[\"plane_api_key_enc\"] = ProtectSecretForConfig(config.PlaneApiKey);\n     j[\"github_pat_enc\"] = ProtectSecretForConfig(config.GitHubPat);\n     const std::string mcpAuthTokenEnc = ProtectSecretForConfig(config.McpAuthToken);\n     // keep the legacy plaintext fallback if DPAPI fails instead of dropping the only copy.\n     if (config.McpAuthToken.empty() || !mcpAuthTokenEnc.empty()) {\n         j.erase(\"mcp_auth_token\");\n     }\n",
  "toolPosture": "read-only",
  "delegationPacket": "Review this diff to Source_Core/src/ConfigManager.cpp (Windows secret-persist path) for correctness bugs. Focus on data-loss / credential-safety. Report each finding with file:line, a severity (critical/high/medium/low/info), and a one-line summary.",
  "dimensions": [
    {
      "key": "correctness",
      "kind": "judge",
      "description": "Did the agent identify the unconditional github_pat erase-before-encrypt data-loss bug and contrast it with the guarded mcp_auth_token pattern?"
    },
    {
      "key": "cited_file_line",
      "kind": "objective",
      "check": "cited_file_line"
    },
    {
      "key": "severity_enum",
      "kind": "objective",
      "check": "severity_enum"
    },
    {
      "key": "finding_count",
      "kind": "objective",
      "check": "finding_count"
    }
  ],
  "referenceOutcome": {
    "expectedFindingCount": 1,
    "allowedSeverities": [
      "critical",
      "high",
      "medium",
      "low",
      "info"
    ],
    "expectedFindings": [
      {
        "file": "Source_Core/src/ConfigManager.cpp",
        "line": 374,
        "severity": "high",
        "summary": "j.erase(github_pat) runs unconditionally before the DPAPI encrypt on the next line is confirmed non-empty; if ProtectSecretForConfig fails, the PAT is irrecoverably lost. The mcp_auth_token field below shows the correct guarded-erase pattern."
      }
    ],
    "notes": "Ground truth = fix commit c76256de (fix(github-tracker): apply 5 CodeRabbit findings missed on #357). repoRef 5c6e97fd is the buggy parent. Path is the historical Source_Core/ layout (later restructured to Source/Core/). One genuine finding."
  }
}
