{
  "schemaVersion": 1,
  "caseId": "cr-null-deref-grid",
  "agent": "code-review",
  "description": "Seed case: a real null-deref where a grid row lookup can return null but the caller dereferences unconditionally. Verifies code-review catches the missing guard and cites file:line.",
  "repoRef": "fdccba25",
  "baseBranch": "develop",
  "files": [
    "Source/Core/src/Grid/TicketGridModel.cpp"
  ],
  "toolPosture": "read-only",
  "delegationPacket": "Review the staged diff to Source/Core/src/Grid/TicketGridModel.cpp for correctness bugs. The change adds a row-by-id lookup and immediately reads a field off the result. Report each finding with file:line, a severity (critical/high/medium/low/info), and a one-line summary.",
  "dimensions": [
    { "key": "correctness", "kind": "judge", "description": "Did the agent find the genuine null-deref and avoid inventing bugs?" },
    { "key": "cited_file_line", "kind": "objective", "check": "cited_file_line", "description": "Every finding cites a concrete file:line." },
    { "key": "severity_enum", "kind": "objective", "check": "severity_enum", "description": "Severities are drawn from the allowed enum." },
    { "key": "finding_count", "kind": "objective", "check": "finding_count", "description": "Finding count is close to the reference count." }
  ],
  "referenceOutcome": {
    "expectedFindingCount": 1,
    "allowedSeverities": ["critical", "high", "medium", "low", "info"],
    "expectedFindings": [
      {
        "file": "Source/Core/src/Grid/TicketGridModel.cpp",
        "severity": "high",
        "summary": "RowById() may return nullptr; the field read on the next line dereferences it without a guard."
      }
    ],
    "notes": "Seed case for the MVP contract proof — to be replaced by a harvested real trace in Phase 2 (subagent-eval-flywheel.md). The single genuine finding is the unguarded deref; a strong run reports exactly one finding."
  }
}
